{"project_title":"COLONY (2026) — 백신이라 믿었던 남자","summary":"생물학적 테러가 발생한 둥우리 빌딩에서 생존자들이 유일한 백신을 자처하는 서영철을 구하려 하지만, 그가 감염자 전체를 움직이는 핵심 개체임을 밝혀내며 제거를 선택하는 21분 46초 분량의 결말 포함 리뷰 편집표.","target_duration_sec":1305.746,"style_notes":["결말을 숨긴 백신 발언으로 콜드 오픈한 뒤 원래 사건 순서로 전개한다.","차분한 남성 나레이션과 핵심 원음 대사를 교차해 집단 지성의 규칙과 인물의 선택을 연결한다.","중반에는 서영철 확보와 감염망 조종자 반전을, 후반에는 정부의 오판과 권세정의 결단을 충분히 축적한다.","액션은 짧은 컷의 나열보다 작전의 목적, 실패의 결과, 다음 선택이 선명하게 이어지도록 구성한다."],"segments":[{"order":1,"source_start":101.791,"source_end":115.791,"kind":"hook","story_beat":"cold_open","purpose":"테러범을 죽일 수도 살려 둘 수도 없게 만드는 역설적인 선언으로 즉시 긴장을 만든다.","narration":"","keep_original_audio":true,"audio_level":0.96,"transition":"dip_to_black"},{"order":2,"source_start":150,"source_end":172,"kind":"narration","story_beat":"setup","purpose":"참사가 시작될 공간과 그 안에 모인 사람들을 빠르게 소개한다.","narration":"이야기의 무대는 바이오 기업과 여러 시설이 함께 입주한 둥우리 빌딩. 이날 이곳에 모인 사람들은 곧 하나의 실험 안에 갇히게 된다.","keep_original_audio":false,"audio_level":0.18,"transition":"cut"},{"order":3,"source_start":230,"source_end":252,"kind":"narration","story_beat":"setup","purpose":"체인스 바이오의 연구가 이후 감염 사태와 연결될 기반을 놓는다.","narration":"체인스 바이오가 공개하려는 기술은 생물 칩끼리 정보를 나누고 학습하게 만드는 것. 문제는 그 연결이 인간에게도 가능하다는 데 있었다.","keep_original_audio":false,"audio_level":0.18,"transition":"cut"},{"order":4,"source_start":268,"source_end":290,"kind":"movie_dialogue","story_beat":"setup","purpose":"영화 전체의 감염 원리를 예고하는 집단 지성 개념을 원음으로 각인한다.","narration":"","keep_original_audio":true,"audio_level":0.94,"transition":"cut"},{"order":5,"source_start":350,"source_end":372,"kind":"narration","story_beat":"setup","purpose":"규성과 세정, 나윤과 현석의 관계를 후일의 희생과 선택에 연결한다.","narration":"한편 규성은 헤어진 세정의 새 출발을 돕고 싶어 하고, 나윤은 같은 건물에서 일하는 동생 현석을 챙긴다. 평범한 관계들이 곧 생존의 이유가 된다.","keep_original_audio":false,"audio_level":0.17,"transition":"fade"},{"order":6,"source_start":490,"source_end":512,"kind":"narration","story_beat":"inciting_incident","purpose":"대테러 팀의 경고를 통해 발표회 이면의 위협을 드러낸다.","narration":"대테러 팀장 이봉석은 강우철을 찾아와 전 연구원 서영철이 이 건물을 노리고 있다고 경고한다. 그러나 테러는 이미 준비를 마친 뒤였다.","keep_original_audio":false,"audio_level":0.19,"transition":"cut"},{"order":7,"source_start":600,"source_end":622,"kind":"narration","story_beat":"inciting_incident","purpose":"서영철과 강우철의 개인적 원한을 테러의 기원으로 연결한다.","narration":"서영철은 자신의 연구를 빼앗은 강우철과 회사를 심판하려 한다. 하지만 그의 복수는 한 사람을 향한 공격이 아니라 인간의 개별성을 없애려는 실험이었다.","keep_original_audio":false,"audio_level":0.18,"transition":"cut"},{"order":8,"source_start":642,"source_end":664,"kind":"movie_dialogue","story_beat":"inciting_incident","purpose":"서영철이 대량 감염을 진화이자 신인류의 탄생으로 믿는다는 사실을 밝힌다.","narration":"","keep_original_audio":true,"audio_level":0.96,"transition":"cut"},{"order":9,"source_start":790,"source_end":812,"kind":"narration","story_beat":"inciting_incident","purpose":"서영철의 선언이 실제 이상 증세와 봉쇄 요청으로 전환되는 순간을 압축한다.","narration":"잠시 뒤 경찰이 이성을 잃은 사람들을 발견한다. 말뿐이던 신인류의 탄생은 전염성 높은 공격으로 현실이 되고, 건물의 출구부터 닫히기 시작한다.","keep_original_audio":false,"audio_level":0.2,"transition":"dip_to_black"},{"order":10,"source_start":850,"source_end":872,"kind":"montage","story_beat":"rising_action","purpose":"대피 방송과 혼란을 묶어 빌딩 전체가 위험 구역으로 변했음을 보여 준다.","narration":"대피 명령이 떨어지지만 누구도 위험의 정체를 모른다. 서로 다른 층에 있던 사람들은 안전한 출구 대신 같은 감염 구역으로 몰려든다.","keep_original_audio":false,"audio_level":0.19,"transition":"cut"},{"order":11,"source_start":980,"source_end":1002,"kind":"narration","story_beat":"rising_action","purpose":"주요 생존자들이 한데 모이는 과정을 협력의 시작으로 정리한다.","narration":"세정과 규성, 나윤과 현석은 경찰과 다른 생존자들에게 합류한다. 서로를 믿을 이유는 없지만, 혼자 움직이는 순간 표적이 된다는 사실은 분명했다.","keep_original_audio":false,"audio_level":0.17,"transition":"cut"},{"order":12,"source_start":1100,"source_end":1122,"kind":"montage","story_beat":"rising_action","purpose":"감염자들의 공격성을 체감시키고 생존자들의 이동 선택을 재촉한다.","narration":"감염자들은 통증도 두려움도 없이 사람을 쫓는다. 일행은 맞서 싸우기보다 문과 통로를 이용해 거리를 벌리지만, 포위망은 빠르게 좁아진다.","keep_original_audio":false,"audio_level":0.21,"transition":"cut"},{"order":13,"source_start":1187,"source_end":1209,"kind":"movie_dialogue","story_beat":"rising_action","purpose":"무질서한 공격이 예고된 생물학적 테러의 결과임을 생존자들에게 확정한다.","narration":"","keep_original_audio":true,"audio_level":0.94,"transition":"fade"},{"order":14,"source_start":1280,"source_end":1302,"kind":"narration","story_beat":"rising_action","purpose":"위험에 남겨진 학생들을 구할지를 첫 공동체적 선택으로 제시한다.","narration":"도망칠 길을 찾던 일행은 학생들이 감염자들에게 막혔다는 사실을 안다. 자신들만 숨을 수도 있지만, 규성은 위험을 알면서도 유인책에 나선다.","keep_original_audio":false,"audio_level":0.18,"transition":"cut"},{"order":15,"source_start":1410,"source_end":1432,"kind":"montage","story_beat":"rising_action","purpose":"감염자를 분산시키는 구조 작전과 즉흥적인 협력을 속도감 있게 전달한다.","narration":"누군가는 소리를 내 감염자들을 끌고, 다른 사람들은 학생들이 빠져나갈 통로를 연다. 계획은 단순하지만 한 명만 늦어도 모두가 붙잡힌다.","keep_original_audio":false,"audio_level":0.2,"transition":"cut"},{"order":16,"source_start":1570,"source_end":1592,"kind":"narration","story_beat":"rising_action","purpose":"규성의 희생을 세정의 감정선과 생존자들의 죄책감에 연결한다.","narration":"사람들을 먼저 보낸 규성은 끝내 돌아오지 못한다. 세정은 슬퍼할 틈조차 없이 움직여야 하고, 살아남은 이들에게는 구조받았다는 안도보다 빚이 남는다.","keep_original_audio":false,"audio_level":0.16,"transition":"fade"},{"order":17,"source_start":1760,"source_end":1782,"kind":"narration","story_beat":"rising_action","purpose":"외부 구조가 차단되면서 생존자들이 스스로 탈출 조건을 만들어야 함을 강조한다.","narration":"더 나쁜 소식도 도착한다. 당국은 감염 확산을 막기 위해 빌딩을 완전히 격리했고, 안에 남은 사람들을 데리러 들어올 수 없다고 통보한다.","keep_original_audio":false,"audio_level":0.18,"transition":"dip_to_black"},{"order":18,"source_start":1850,"source_end":1872,"kind":"narration","story_beat":"rising_action","purpose":"막연한 탈출을 서영철 확보라는 구체적인 목표로 전환할 준비를 한다.","narration":"출구도 구조대도 사라진 상황에서 대테러 팀은 단 하나의 가능성을 전한다. 테러를 설계한 서영철이 자신의 몸에 해독의 열쇠를 넣었다는 것이다.","keep_original_audio":false,"audio_level":0.19,"transition":"cut"},{"order":19,"source_start":1909,"source_end":1931,"kind":"movie_dialogue","story_beat":"rising_action","purpose":"서영철을 찾아 밖으로 데려가면 모두 구조될 수 있다는 새 목표를 원음으로 제시한다.","narration":"","keep_original_audio":true,"audio_level":0.95,"transition":"cut"},{"order":20,"source_start":1996,"source_end":2018,"kind":"movie_dialogue","story_beat":"rising_action","purpose":"집단 지성의 정보망에 거짓 정보를 넣는 생존자들의 첫 능동적 작전을 설명한다.","narration":"","keep_original_audio":true,"audio_level":0.93,"transition":"cut"},{"order":21,"source_start":2180,"source_end":2202,"kind":"narration","story_beat":"rising_action","purpose":"감염자들의 정보 교환 방식을 냄새를 이용한 유인책과 연결한다.","narration":"세정은 감염자들이 서로의 정보를 공유한다면 한 개체의 착각도 무리 전체로 번질 수 있다고 본다. 일행은 서로 다른 냄새를 이용해 가짜 목표를 만든다.","keep_original_audio":false,"audio_level":0.17,"transition":"cut"},{"order":22,"source_start":2400,"source_end":2422,"kind":"montage","story_beat":"rising_action","purpose":"가설을 실제 이동 작전으로 시험하는 과정의 불확실성과 긴장을 축적한다.","narration":"작전이 시작되자 감염자 무리는 잘못된 냄새를 따라 움직인다. 그러나 효과가 얼마나 갈지는 알 수 없다. 일행은 틈이 닫히기 전에 층을 가로질러야 한다.","keep_original_audio":false,"audio_level":0.2,"transition":"cut"},{"order":23,"source_start":2660,"source_end":2682,"kind":"narration","story_beat":"rising_action","purpose":"서영철이 있는 3층 도착을 작전의 성과이자 다음 위험의 문턱으로 만든다.","narration":"몇 번의 위기를 넘긴 끝에 생존자들은 서영철이 숨어 있는 3층에 도착한다. 이제 남은 일은 백신을 확보하는 것처럼 보이지만, 정작 서영철은 구조를 원하지 않는다.","keep_original_audio":false,"audio_level":0.18,"transition":"fade"},{"order":24,"source_start":2710,"source_end":2732,"kind":"narration","story_beat":"reversal","purpose":"서영철 확보 뒤에도 옥상까지 직접 호송해야 한다는 추가 조건을 제시한다.","narration":"일행은 마침내 서영철을 붙잡지만 구조대가 내려와 데려갈 수는 없다. 감염자들이 가득한 건물을 통과해 그를 옥상까지 직접 호송해야 한다.","keep_original_audio":false,"audio_level":0.19,"transition":"cut"},{"order":25,"source_start":2830,"source_end":2852,"kind":"montage","story_beat":"reversal","purpose":"서영철의 도주로 백신 확보 작전이 다시 추격전으로 바뀌는 순간을 보여 준다.","narration":"이동 도중 서영철은 작은 틈을 놓치지 않고 달아난다. 그를 잃으면 구조 가능성도 사라진다는 믿음 때문에 생존자들은 더 위험한 통로로 추격한다.","keep_original_audio":false,"audio_level":0.2,"transition":"cut"},{"order":26,"source_start":2954,"source_end":2976,"kind":"movie_dialogue","story_beat":"reversal","purpose":"감염자들이 서영철을 공격하지 않는 현상으로 백신 주장을 강화한다.","narration":"","keep_original_audio":true,"audio_level":0.96,"transition":"cut"},{"order":27,"source_start":3000,"source_end":3022,"kind":"narration","story_beat":"reversal","purpose":"감염자들의 모방 행동과 CCTV 추적 계획을 다음 단계의 위협으로 연결한다.","narration":"하지만 감염자들은 인간의 움직임까지 흉내 내기 시작한다. 일행은 무작정 뒤쫓는 대신 CCTV 통제실에서 서영철의 위치와 안전한 경로를 함께 찾기로 한다.","keep_original_audio":false,"audio_level":0.18,"transition":"dip_to_black"},{"order":28,"source_start":3050,"source_end":3072,"kind":"narration","story_beat":"rising_action","purpose":"외부 조사 팀의 발견을 통해 감염망에 중심 개체가 존재할 가능성을 제시한다.","narration":"한편 특별 조사 팀은 서영철의 연구실에서 살아 있는 실험 개체들을 발견한다. 이들은 따로 움직이는 듯하면서도 한 개체의 신호에 함께 반응한다.","keep_original_audio":false,"audio_level":0.17,"transition":"cut"},{"order":29,"source_start":3230,"source_end":3252,"kind":"narration","story_beat":"rising_action","purpose":"통제실 도착을 안전 확보가 아니라 감염망 관찰의 시작으로 전환한다.","narration":"생존자들은 통제실에 도착해 건물 전체의 화면을 확인한다. 그런데 자신들이 감염자를 피한 순간마다 서영철도 방향을 바꿨다는 이상한 공통점이 드러난다.","keep_original_audio":false,"audio_level":0.18,"transition":"cut"},{"order":30,"source_start":3425,"source_end":3447,"kind":"movie_dialogue","story_beat":"rising_action","purpose":"서영철이 감염자들의 시야를 공유할 수 있다는 가설을 원음으로 명확히 한다.","narration":"","keep_original_audio":true,"audio_level":0.94,"transition":"cut"},{"order":31,"source_start":3500,"source_end":3522,"kind":"narration","story_beat":"rising_action","purpose":"추적 대상이 오히려 생존자들을 감시한다는 관계 역전을 강조한다.","narration":"그 추론이 맞다면 CCTV만으로 우위를 얻을 수 없다. 복도에 감염자 한 명만 있어도 서영철은 생존자들의 위치와 계획을 실시간으로 알아낼 수 있다.","keep_original_audio":false,"audio_level":0.19,"transition":"cut"},{"order":32,"source_start":3570,"source_end":3592,"kind":"narration","story_beat":"rising_action","purpose":"서영철이 강우철을 찾아가는 움직임을 두 인물의 재대결과 새 반전으로 연결한다.","narration":"화면 속 서영철은 탈출구가 아니라 최초 감염자로 보이는 강우철에게 향한다. 복수의 대상과 다시 만나는 순간, 감염망의 성질도 결정적으로 달라진다.","keep_original_audio":false,"audio_level":0.18,"transition":"fade"},{"order":33,"source_start":3610,"source_end":3632,"kind":"narration","story_beat":"reversal","purpose":"강우철에게 물린 서영철의 변화가 백신 전제에 균열을 내도록 한다.","narration":"강우철에게 물린 뒤에도 서영철은 쓰러지지 않는다. 오히려 감염자들의 반응을 느끼고 그들에게 의지를 전달하듯 행동하기 시작한다.","keep_original_audio":false,"